{
  "updated_at": "Actualizado dom 29 marzo",
  "nivel": "Nivel Dragones",
  "ciclo": "Lunes 30 de marzo al sábado 4 de abril del 2026",
  "enfoque_corto": "Flexibilidad + Técnico pateo + taeguk 4 últimas dos lineas",
  "enfoque": "Concluimos con el trabajo de taeguk 4 desde las bases profundas",
 "chanonaflexDias": "LUN A SAB · 1 serie",
  "chanonaflex": [
    {
      "titulo": "ChanonaFlex • Nivel 1",
      "dia": "LUNES A SÁBADO",
      "tipo": "video",
      "url": "https://drive.google.com/file/d/1jnSjVKx7mPFKco3HttgzmQUQgAsMm9Kt/view?usp=drive_link"
    }
  ],
  "isometricoDias": "LUN - VIE",
  "isometrico": [
    {
      "titulo": "Ap Chagui - NIVEL 1",
      "tipo": "video",
      "url": "https://drive.google.com/file/d/1kbkZqudxFm3GqgXyrEiKM_ODwrMk3ppx/view?usp=drive_link",
      "tags": ["FUERZA, FORTALECIMIENTO, FLEX"]
    }
  ],
  "pateoDias": "MAR - JUE - SAB",
  "pateoTecnico": [
     {
      "titulo": "Ap hold 3 + L2 koryo",
      "enfoque": "Cuádriceps + Equilibrio + fortalecimiento",
      "reps": "7 reps / 2 series",
      "tipo": "video",
      "url": "https://drive.google.com/file/d/1Tuep3FQZCHwcQuziQAnDoSbwnwCugKYz/view?usp=drivesdk"
    },
    {
      "titulo": "Ap chagui + dos bloques",
      "enfoque": "Estabilidad + técnica + fuerza",
      "reps": "3 reps / 2 series",
      "tipo": "video",
      "url": "https://drive.google.com/file/d/1cdbZKTfQ1kzIFEfiUBQb7wusgY2fhXXa/view?usp=drivesdk"
    },
    {
      "titulo": "propuesta + ap chagui reps",
      "enfoque": "Control + técnica + fuerza",
      "reps": "5 reps / 1 serie",
      "tipo": "video",
      "url": "https://drive.google.com/file/d/1dmkR7vXtDA1P19Ymc8cgoIUFqoUVsdO4/view?usp=drivesdk"
    }
  ],
  "poomsaeDias": "LUN - MIE - VIE",
  "poomsae": [
    {
      "titulo": "Transicion L3 a L4 de T4 -  taeguk 4",
      "enfoque": "Repetición + técnica + precisión",
      "reps": "10 reps / 2 series",
      "tipo": "video",
      "url": "https://drive.google.com/file/d/1jywGe4cJnLzTFwwpX_JlXR7GPUxlBSMk/view?usp=drivesdk"
    },
    {
     "titulo": "Ap + Backfist de T4 L4 - Taeguk 4",
      "enfoque": "Repetición + técnica + precisión",
      "reps": "20 reps / 2 series",
      "tipo": "video",
      "url": "https://drive.google.com/file/d/1BtdMNbAEA77j4-GIMxgreKYNDnbnYeiO/view?usp=drivesdk"
    }
  ],
  "apuntes": [
    "LEER NOTAS FINALES"
  ],
  "notasFinales": [
    "Excelente trabajo el de esta semana concluyendo nuestro taeguk 4 con detalles finos e importantes, ahora nos preparamos para comenzar con todo nuestro taeguk 5",
"Continuamos trabajando con los ejercicios para continuar fortaleciendo, y por favor coménteme como va con ello, es importante para darle el seguimiento que se merece",
    "¡Feliz entrenamiento!"
  ]
}
