{
  "updated_at": "Actualizado dom 10 de mayo",
  "nivel": "Nivel Dragones",
  "ciclo": "Lunes 11 al sábado 23 de mayo del 2026",
  "enfoque_corto": "Taeguk 6 (L1-L3) + Control Estructural de Pateo",
  "enfoque": "Desarrollo de la estabilidad estructural en Taeguk 6, priorizando la extensión de la pierna de apoyo y la firmeza del torso en las transiciones y el pateo frontal.",
  "chanonaflexDias": "LUN A SAB · 1 serie",
  "chanonaflex": [
    {
      "titulo": "ChanonaFlex • Nivel 1",
      "dia": "LUNES A SÁBADO",
      "tipo": "video",
      "url": "https://drive.google.com/file/d/1jnSjVKx7mPFKco3HttgzmQUQgAsMm9Kt/view?usp=drive_link"
    },
    {
      "titulo": "Pre-Chanonaflex - Estiramiento inicial",
      "dia": "LUNES A SÁBADO",
      "tipo": "video",
      "url": "https://drive.google.com/file/d/1mV7dkockaExAief_qW7RsMUuouwfMKM7/view?usp=drive_link"
    }
  ],
  "isometricoDias": "LUN - MIE - VIE",
  "isometrico": [
    {
      "titulo": "Isométrico Activo - Ap Chagui - Nivel 1",
      "tipo": "video",
      "url": "https://drive.google.com/file/d/1kbkZqudxFm3GqgXyrEiKM_ODwrMk3ppx/view?usp=drive_link",
      "tags": ["FUERZA, FORTALECIMIENTO, FLEX"]
    },
    {
      "titulo": "Isométrico Activo - Dollyo Chagui - Nivel 1",
      "tipo": "video",
      "url": "https://drive.google.com/file/d/1y02E8_WF2d624jJWJvinIn2oNIBcbXcc/view?usp=drive_link",
      "tags": ["FUERZA, FORTALECIMIENTO, FLEX"]
    }
  ],
  "pateoDias": "MAR - JUE - SAB",
  "pateoTecnico": [
    {
      "titulo": "Ap + Dollyo + Yop con regreso",
      "enfoque": "Control de pierna de apoyo y firmeza de torso",
      "reps": "10 reps por pierna / 2 series",
      "tipo": "video",
      "url": "https://drive.google.com/open?id=1pUIqQv-TZfUGYydpdg8bMH9qJrEpVTXR"
    },
    {
      "titulo": "Ap + Descendente frontal circuito",
      "enfoque": "Direccionamiento de rodilla y extensión de base",
      "reps": "12 reps / 2 series",
      "tipo": "video",
      "url": "https://drive.google.com/open?id=10yu4P3fSnYpOuMODflI-7yyZq1alYNIH"
    },
    {
      "titulo": "Secuencia Ap + Dollyo + Yop",
      "enfoque": "Equilibrio neuromuscular y encadenamiento",
      "reps": "5 secuencias por pierna / 2 series",
      "tipo": "video",
      "url": "https://drive.google.com/open?id=1mpJeBddYKmXUuJUMocQN42QzRwtlzSqr"
    },
    {
      "titulo": "Ap Chagui contra pared",
      "enfoque": "Fijación del talón y rodilla de apoyo extendida",
      "reps": "20 reps por lado / 2 series",
      "tipo": "video",
      "url": "https://drive.google.com/file/d/1CX6PkR9CrTaOvZxrZPKTyc1mPfcfJ4wp/view?usp=drive_link"
    },
    {
      "titulo": "Circuito elevacion + sostener + circular",
      "enfoque": "Fortalecimiento de cuádriceps y sostén técnico",
      "reps": "10 reps / 2 series",
      "tipo": "video",
      "url": "https://drive.google.com/open?id=1Jrwnad5LdAZdG1d_75e2QI7U2sEVLcSP"
    }
  ],
  "poomsaeDias": "LUNES A SÁBADO",
  "poomsae": [
    {
      "titulo": "Timing - Línea 1 de Taeguk 6",
      "enfoque": "Ritmo de competencia y audios de referencia",
      "reps": "10 min de práctica",
      "tipo": "audio",
      "url": "https://drive.google.com/open?id=1Qlt4HXhI6Pw77woVdH-rPP6QfC16qJ9O"
    },
    {
      "titulo": "Timing - Línea 2 y 3 de Taeguk 6",
      "enfoque": "Transiciones fluidas y cortes",
      "reps": "10 min de práctica",
      "tipo": "audio",
      "url": "https://drive.google.com/open?id=1asDEGqi_YWGMnDZioMY_lYOZUpYIZPAR"
    },
    {
      "titulo": "L2 a L3 de Taeguk 6 - T6",
      "enfoque": "Precisión en defensas y giros",
      "reps": "10 reps conscientes",
      "tipo": "video",
      "url": "https://drive.google.com/open?id=1qM7-pg_CPQ480Oqb3fKD-nb4noUaKEEy"
    },
    {
      "titulo": "Defensa a la cara Taeguk 6",
      "enfoque": "Trayectoria y punto de impacto",
      "reps": "20 reps / 2 series",
      "tipo": "video",
      "url": "https://drive.google.com/open?id=1t7jfM7QOba7tFmJ6kfcXNYonl-pyJJrv"
    },
    {
      "titulo": "Ap chagui, prep y aterrizaje correcto",
      "enfoque": "Control de eje en Taeguk 6",
      "reps": "15 reps por pierna",
      "tipo": "video",
      "url": "https://drive.google.com/open?id=1avHtkOVL1SY9c4sy4ugT5t260DCeu3Fz"
    }
  ],
  "apuntes": [
    "Busca específicamente no flexionar la pierna de apoyo cuando estamos pateando. Esta siempre debe estar firme y extendida, tanto en Ap Chagui como en Dollyo Chagui.",
    "En las líneas 1, 2 y 3 de Taeguk 6, mantén siempre la firmeza en el torso. No lleves los hombros al frente; aunque la pierna pueda estar inestable, el torso jamás debe perder su eje.",
    "Debes direccionar siempre con la rodilla hacia donde estás pateando. La rodilla es tu guía técnica para que la patada no se 'abra' o pierda potencia.",
    "En Taeguk 6, las defensas exteriores y giros deben ejecutarse con el talón de apoyo bien anclado hasta el momento de la transición. No permitas que el talón se eleve prematuramente.",
    "Usa los audios de timing para las primeras tres líneas; el contraste entre la fluidez del giro y el congelamiento del bloqueo es lo que marcará la diferencia ante el juez."
  ],
  "notasFinales": [
    "Carlos, estamos entrando en una fase de madurez técnica con Taeguk 6. El control de su pierna de base determinará la limpieza de su forma completa.",
    "He incluido los nuevos circuitos de encadenamiento para fortalecer su equilibrio dinámico. No los salte, son la clave de su estabilidad.",
    "Cualquier duda con los recorridos de la línea 2 y 3, coméntame de inmediato.",
    "¡Feliz entrenamiento y a darle con todo!"
  ]
}
