{
  "updated_at": "2026-10-15",
  "nivel": "Nivel Dragones",
  "ciclo": "Thursday, October 15 to Wednesday, October 28, 2026",
  "enfoque_corto": "Clean technique, steady progress",
  "enfoque": "ChanonaFlex: Monday to Saturday. Active isometric: Monday and Friday / Tuesday and Thursday / Wednesday and Saturday. Technical kicking: Monday and Wednesday / Tuesday and Thursday. Poomsae: Monday to Saturday.",
  "chanonaflexDias": "Monday to Saturday",
  "chanonaflex": [
    {
      "titulo": "Pre-Chanonaflex - Initial stretch",
      "tipo": "video",
      "url": "https://drive.google.com/file/d/1mV7dkockaExAief_qW7RsMUuouwfMKM7/view?usp=sharing",
      "dia": "Monday to Saturday",
      "enfoque": "Prepare your body before the main workout.",
      "reps": "Follow the video"
    },
    {
      "titulo": "Chanonaflex From Proposal - Level 3",
      "tipo": "video",
      "url": "https://drive.google.com/file/d/16UN5_qf8r8Vr5SVuWnuU5KaNibrzFcDQ/view?usp=sharing",
      "dia": "Monday to Saturday",
      "enfoque": "Work on range, control and alignment.",
      "reps": "Follow the video"
    }
  ],
  "isometricoDias": "Monday and Friday / Tuesday and Thursday / Wednesday and Saturday",
  "isometrico": [
    {
      "titulo": "Glute and hook - Active isometric - Intermediate",
      "tipo": "video",
      "url": "https://drive.google.com/file/d/1S4PWmc52Ot9k-IrXt38L-Spx0tjqj8Lr/view?usp=sharing",
      "dia": "Monday and Friday",
      "enfoque": "Develop glute strength and hip control.",
      "reps": "Follow the video"
    },
    {
      "titulo": "Active Isometric - Yop Chagui - Level 1",
      "tipo": "video",
      "url": "https://drive.google.com/file/d/1ptuIEmfskjKeBhYfvW4JZVvW5hIIdCbx/view?usp=sharing",
      "dia": "Tuesday and Thursday",
      "enfoque": "Maintain your chamber, support leg and alignment.",
      "reps": "Follow the video"
    },
    {
      "titulo": "Active Isometric - Ap Chagui - Level 1",
      "tipo": "video",
      "url": "https://drive.google.com/file/d/1kbkZqudxFm3GqgXyrEiKM_ODwrMk3ppx/view?usp=sharing",
      "dia": "Wednesday and Saturday",
      "enfoque": "Work on Ap Chagui strength and a controlled return.",
      "reps": "Follow the video"
    }
  ],
  "pateoDias": "Monday and miércoles / Tuesday and Thursday",
  "pateoTecnico": [
    {
      "titulo": "Hip rotation with resistance band",
      "tipo": "video",
      "url": "https://drive.google.com/open?id=1-mLzWj3XiEzCeul7LaIWuPzP39qQ6VtQ&usp=drive_copy",
      "dia": "Monday and miércoles",
      "enfoque": "Work at maximum speed. Rest 15 seconds between sets.",
      "reps": "20 repetitions / 4 sets"
    },
    {
      "titulo": "Ankle strengthening with resistance band",
      "tipo": "video",
      "url": "https://drive.google.com/file/d/1Sux7kXiJImkagl3ye2nN2bMjqmJOa18O/view?usp=drive_link",
      "dia": "Monday and miércoles",
      "enfoque": "Perform every repetition extremely slowly.",
      "reps": "5 repetitions per side / 1 set"
    },
    {
      "titulo": "Balance Ap + Dollyo + Yop",
      "tipo": "video",
      "url": "https://drive.google.com/file/d/1H5wkZLaFmtdAd9CoqllwN7m-OB156tei/view?usp=sharing",
      "dia": "Monday and miércoles",
      "enfoque": "Maintain balance and control throughout the sequence.",
      "reps": "10 repetitions per leg / 2 sets"
    },
    {
      "titulo": "Ap Chagui - Full extension",
      "tipo": "video",
      "url": "https://drive.google.com/file/d/1QwJjk1Ku_Vl3dOgMIhPJ9q-zSkvv6BuU/view?usp=sharing",
      "dia": "Monday and miércoles",
      "enfoque": "Do not twist your torso or raise your shoulders. Always keep your support leg extended.",
      "reps": "30 repetitions per leg / 2 sets"
    },
    {
      "titulo": "Yop Chagui split",
      "tipo": "video",
      "url": "https://drive.google.com/file/d/1y5VPwL9XoGo8javxUs5KPpsFRhmVpoyA/view?usp=sharing",
      "dia": "Tuesday and Thursday",
      "enfoque": "Reach your maximum extension without shifting your glute or hip. Your knee must not hurt.",
      "reps": "30 repetitions / 2 sets"
    },
    {
      "titulo": "Yop Chagui + floor touch + balance",
      "tipo": "video",
      "url": "https://drive.google.com/file/d/1ZQ3ud3bkEQJcvSnUelWDVR4ECdwv1_Vn/view?usp=sharing",
      "dia": "Tuesday and Thursday",
      "enfoque": "Do not move your support foot, even if your kicking leg drops.",
      "reps": "10 repetitions per side / 2 sets"
    },
    {
      "titulo": "Chamber + Koryo L3 + T5 L5",
      "tipo": "video",
      "url": "https://drive.google.com/file/d/15eKiPwUQSRQAutTZ1s1XD8s-stSXe9PE/view?usp=sharing",
      "dia": "Tuesday and Thursday",
      "enfoque": "Do not move your support foot, even if your raised leg drops.",
      "reps": "10 repetitions per side / 2 sets"
    },
    {
      "titulo": "Yop Chagui circuit with block",
      "tipo": "video",
      "url": "https://drive.google.com/file/d/10nz0e_wowhkr4rk7uUlobLrKCFpA6OXy/view?usp=sharing",
      "dia": "Tuesday and Thursday",
      "enfoque": "Stay completely steady in every static position.",
      "reps": "5 repetitions per side / 1 set"
    }
  ],
  "poomsaeDias": "Monday to Saturday",
  "poomsae": [
    {
      "titulo": "Thursday 15 October 2026",
      "dia": "Thursday 15 October 2026",
      "enfoque": "Taeguk 4 (Line 2): 10 min | Taeguk 5 (Line 2): 10 min",
      "reps": "Follow the specified times, sets and rest periods.",
      "tipo": "info"
    },
    {
      "titulo": "Friday 16 October 2026",
      "dia": "Friday 16 October 2026",
      "enfoque": "Koryo (Line 2): 10 min | Keumgang (Line 2): 10 min | Complete Poomsae of the day: Taeguk 4, Taeguk 5 and Koryo (4 sets of all 3 forms back-to-back at maximum timing speed, with 1 minute of rest between sets)",
      "reps": "Follow the specified times, sets and rest periods.",
      "tipo": "info"
    },
    {
      "titulo": "Saturday 17 October 2026",
      "dia": "Saturday 17 October 2026",
      "enfoque": "Keumgang (Line 6): 10 min | Taeguk 4 (Line 2): 10 min",
      "reps": "Follow the specified times, sets and rest periods.",
      "tipo": "info"
    },
    {
      "titulo": "Monday 19 October 2026",
      "dia": "Monday 19 October 2026",
      "enfoque": "Taeguk 5 (Line 2): 10 min | Koryo (Line 2): 10 min",
      "reps": "Follow the specified times, sets and rest periods.",
      "tipo": "info"
    },
    {
      "titulo": "Tuesday 20 October 2026",
      "dia": "Tuesday 20 October 2026",
      "enfoque": "Keumgang (Line 2): 10 min | Keumgang (Line 6): 10 min",
      "reps": "Follow the specified times, sets and rest periods.",
      "tipo": "info"
    },
    {
      "titulo": "Wednesday 21 October 2026",
      "dia": "Wednesday 21 October 2026",
      "enfoque": "Taeguk 4 (Line 2): 10 min | Taeguk 5 (Line 2): 10 min | Complete Poomsae of the day: Taeguk 4, Taeguk 5 and Koryo (4 sets of all 3 forms back-to-back at maximum timing speed, with 1 minute of rest between sets)",
      "reps": "Follow the specified times, sets and rest periods.",
      "tipo": "info"
    },
    {
      "titulo": "Thursday 22 October 2026",
      "dia": "Thursday 22 October 2026",
      "enfoque": "Taeguk 4 (Line 4): 10 min | Taeguk 5 (Line 5): 10 min",
      "reps": "Follow the specified times, sets and rest periods.",
      "tipo": "info"
    },
    {
      "titulo": "Friday 23 October 2026",
      "dia": "Friday 23 October 2026",
      "enfoque": "Koryo (Line 3): 10 min | Keumgang (Line 4): 10 min | Complete Poomsae of the day: Taeguk 4, Taeguk 5 and Koryo (4 sets of all 3 forms back-to-back at maximum timing speed, with 1 minute of rest between sets)",
      "reps": "Follow the specified times, sets and rest periods.",
      "tipo": "info"
    },
    {
      "titulo": "Saturday 24 October 2026",
      "dia": "Saturday 24 October 2026",
      "enfoque": "Taeguk 4 (Line 4): 10 min | Taeguk 5 (Line 5): 10 min",
      "reps": "Follow the specified times, sets and rest periods.",
      "tipo": "info"
    },
    {
      "titulo": "Monday 26 October 2026",
      "dia": "Monday 26 October 2026",
      "enfoque": "Koryo (Line 3): 10 min | Keumgang (Line 4): 10 min",
      "reps": "Follow the specified times, sets and rest periods.",
      "tipo": "info"
    },
    {
      "titulo": "Tuesday 27 October 2026",
      "dia": "Tuesday 27 October 2026",
      "enfoque": "Taeguk 4 (Line 4): 10 min | Taeguk 5 (Line 5): 10 min",
      "reps": "Follow the specified times, sets and rest periods.",
      "tipo": "info"
    },
    {
      "titulo": "Wednesday 28 October 2026",
      "dia": "Wednesday 28 October 2026",
      "enfoque": "Koryo (Line 3): 10 min | Keumgang (Line 4): 10 min | Complete Poomsae of the day: Taeguk 4, Taeguk 5 and Koryo (4 sets of all 3 forms back-to-back at maximum timing speed, with 1 minute of rest between sets)",
      "reps": "Follow the specified times, sets and rest periods.",
      "tipo": "info"
    }
  ],
  "indicacionesExtras": [
    "Your effort keeps paying off. Do not worry about what you cannot do yet; recognize how much you have already improved.",
    "Focus on the improvements we have discussed during our Meet training sessions.",
    "Keep your assisting fist at your waist. Maintain your body structure, even if it feels unusual.",
    "Coordinate kick landings with your arm movements. Prepare as you rechamber, then execute as you land, smoothly and without pauses."
  ],
  "apuntes": [],
  "notasFinales": [
    "Enjoy this training cycle. We will increase the intensity slightly; adapt the work to your available time and current physical capacity.",
    "Enjoy your training, and let’s keep giving it our best!"
  ]
}
