{
  "updated_at": "Actualizado dom 1 de marzo",
  "nivel": "Nivel Dragones",
  "ciclo": "Lunes 2 al 7 de marzo del 2026",
  "enfoque_corto": "Flexibilidad + Trabajo técnico de pateo y trabajo técnico de poomsae",
  "enfoque": "Esta semana continuaremos con nuestro entrenamiento de koryo en especifico de las lineas 1 y 2, buscando el timing, presición y entendimiento de los movimientos y preparaciones para mejor ejecución de nuestra poomsae",
 "chanonaflexDias": "LUNES A SÁBADO · 1 serie",
  "chanonaflex": [
    {
      "titulo": "ChanonaFlex • Avanzado",
      "dia": "LUNES A SÁBADO",
      "tipo": "video",
      "url": "https://drive.google.com/file/d/1bvgIvuAgE0kiFASyBQaVQyRRIFFGfnhc/view?usp=drive_link"
    }
  ],
  "isometricoDias": "LUN - MIE - VIE",
  "isometrico": [
     {
      "titulo": "Yop Chagui - NIVEL 2",
      "tipo": "video",
      "url": "https://drive.google.com/file/d/1CmRB-nx4GeoPqFrpaAbClkx71BL3Yxjw/view?usp=drive_link",
      "tags": ["FUERZA, FORTALECIMIENTO, FLEX"]
    },
    {
      "titulo": "Ap Chagui - NIVEL 2",
      "tipo": "video",
      "url": "https://drive.google.com/file/d/1SWtdQOVyBEX7GTYPjPSqKz-kUiruQv6w/view?usp=drive_link",
      "tags": ["FUERZA, FORTALECIMIENTO, FLEX"]
    }
  ],
  "pateoDias": "MAR - JUE - SAB",
  "pateoTecnico": [
     {
      "titulo": "Circuito Hold con banda L2 Koryo",
      "enfoque": "Fortalecimiento de cuádriceps y estabilidad",
      "reps": "20 reps / 2 serie",
      "tipo": "video",
      "url": "https://drive.google.com/file/d/1YiNFRyFkZFZH4Pk3eHe8cOZZorTd6rzK/view?usp=drive_link"
    },
    {
      "titulo": "Silla + Ap Chaguis 3 niveles",
      "enfoque": "Fortalecimiento y explosividad",
      "reps": "20 reps / 2 serie",
      "tipo": "video",
      "url": "https://drive.google.com/file/d/1AS4bfSKwxw9duMZ6Rif4EaldzgSabrGS/view?usp=drive_link"
    },
    {
      "titulo": "Linea 3 Koryo - Sentadilla y camara",
      "enfoque": "Estabilidad + técnica + fuerza",
      "reps": "10 reps / 3 series",
      "tipo": "video",
      "url": "https://drive.google.com/file/d/1dlhr114oOT6oiKKaD_02J-MUBPEma9Gn/view?usp=drive_link"
    },
    {
      "titulo": "Koryo L1 hold yop + Pyonwong ",
      "enfoque": "Equilibrio + técnica + fuerza",
      "reps": "10 reps / 3 series",
      "tipo": "video",
      "url": "https://drive.google.com/file/d/1EvUXdSs21NOAQR8OkD5ip6MeEApvUDDy/view?usp=drive_link"
    }
  ],
  "poomsaeDias": "LUNES A SÁBADO",
  "poomsae": [
    {
      "titulo": "Aterrizaje ap kubi + golpe medio",
      "enfoque": "En el aterrizaje y en la camara",
      "reps": "10 reps / 2 series",
      "tipo": "video",
      "url": "https://drive.google.com/file/d/1FzfcOO8NcL63cVBvahDS2rthF14nDiQT/view?usp=drive_link"
    },
    {
      "titulo": "Camara + L3 Koryo + L1 Koryo + L3 koryo",
      "enfoque": "Repetición + técnica + precisión",
      "reps": "10 reps / 2 series",
      "tipo": "video",
      "url": "https://drive.google.com/file/d/19Bnqxd9uX73eYMDzKuaTW7U4o725JVXK/view?usp=drive_link"
    },
    {
     "titulo": "Linea 3 Koryo - Sentadilla y camara",
      "enfoque": "Control + técnica + precisión",
      "reps": "20 reps / 2 series",
      "tipo": "video",
      "url": "https://drive.google.com/file/d/1dlhr114oOT6oiKKaD_02J-MUBPEma9Gn/view?usp=drive_link"
    },
    {
     "titulo": "Transicion Twit Kubi a Twit Kubi",
      "enfoque": "Transición + técnica + postura",
      "reps": "50 reps por lado/ 2 series",
      "tipo": "video",
      "url": "https://drive.google.com/file/d/1TQjuHQflDQu65fh_zJE1QSTxD2qVaoEX/view?usp=drive_link"
    },
    {
     "titulo": "Circuito Hold con banda L2 Koryo",
      "enfoque": "Fortalecimiento + técnica + postura",
      "reps": "10 reps / 2 series",
      "tipo": "video",
      "url": "https://drive.google.com/file/d/1YiNFRyFkZFZH4Pk3eHe8cOZZorTd6rzK/view?usp=drive_link"
    },
    {
     "titulo": "Linea 2 Koryo - 2.1 ap chagui + golpes",
      "enfoque": "Técnica + postura + timing",
      "reps": "10 reps / 2 series",
      "tipo": "video",
      "url": "https://drive.google.com/file/d/1D2ScTJYlw1cCZw5SfoXn5QlF0LiSjOpv/view?usp=drive_link"
    }
  ],
  "apuntes": [
"LEER NOTAS FINALES"
  ],
  "notasFinales": [
    "Continuamos entrenando y perfeccionando Koryo pero no significa que todo será unicamente esta poomsae, sino que tenemos que perfeccionar lo más posible para mejorar las demás también, por lo que es dble el esfuerzo el que se debe de realizar, no solo la repeticion para mejorar koryo, sino mejorar koryo con el transfondo de todas las demás poomsaes",
    "Cualquier duda, por favor comentame",
    "¡Feliz entrenamiento!"
  ]
}
