{
  "updated_at": "Actualizado dom 1 marzo",
  "nivel": "Nivel Dragones",
  "ciclo": "Lunes 2 al 7 de marzo del 2026",
  "enfoque_corto": "Taeguk 8 Línea 2 - Piernas y brazos",
  "enfoque": "Esta semana le dimos mucha importancia a la linea número 2 de taeguk 8, vamos a trabajar en base a esos apuntes y las sugerencias de ejercicios para los alumnos, cualquier duda por favor comentenme maestros",
 "chanonaflexDias": "LUNES A SÁBADO",
  "chanonaflex": [
    {
      "titulo": "ChanonaFlex • Nivel 1",
      "dia": "LUNES A SÁBADO",
      "tipo": "video",
      "url": "https://drive.google.com/file/d/1jnSjVKx7mPFKco3HttgzmQUQgAsMm9Kt/view?usp=drive_link"
    }
  ],
  "isometricoDias": "NO ASIGNADO ESTA SEMANA",
  "isometrico": [],
  "pateoDias": "3 días a la semana",
  "pateoTecnico": [
     {
      "titulo": "Ap Chagui 3 niveles",
      "enfoque": "Fortalecimiento y preparación de la técnica a un nivel más exigente",
      "reps": "20 reps por pierna / 2 series",
      "tipo": "video",
      "url": "https://drive.google.com/file/d/1iUBOiNH65FT8PGaRTv8kT4gxDV2M6_Az/view?usp=drive_link"
    },
    {
      "titulo": "Ap Chaguis Dos Bloques",
      "enfoque": "Nivel de exigencia con bloques para desarrollar la concentración, coordinación y el equilibrio",
      "reps": "10 reps por pierna / 2 series",
      "tipo": "video",
      "url": "https://drive.google.com/file/d/1cdbZKTfQ1kzIFEfiUBQb7wusgY2fhXXa/view?usp=drive_link"
    },
    {
      "titulo": "Torsión de cadera con banda",
      "enfoque": "Fortalecimiento y precisión de movimiento en cadera, glúteo, ingle e isquiotibiales",
      "reps": "Fallo y después 30 reps",
      "tipo": "video",
      "url": "https://drive.google.com/file/d/1-mLzWj3XiEzCeul7LaIWuPzP39qQ6VtQ/view?usp=drive_link"
    },
    {
      "titulo": "Fortalecimiento de tobillo con banda",
      "enfoque": "Fortalecimiento de tobillo para mejorar la estabilidad y evitar lesiones",
      "reps": "30 reps",
      "tipo": "video",
      "url": "https://drive.google.com/file/d/1Sux7kXiJImkagl3ye2nN2bMjqmJOa18O/view?usp=drive_link"
    }
  ],
  "poomsaeDias": "LUNES A SÁBADO",
  "poomsae": [
    {
      "titulo": "Transicion hacia ap kubi L2 T8 - Taeguk 8",
      "enfoque": "Enfoque en la correcta transición",
      "reps": "30 reps",
      "tipo": "video",
      "url": "https://drive.google.com/file/d/1jLw2HUDloOvSquTlVsgMwYOwJniQsLvW/view?usp=drive_link"
    },
    {
      "titulo": "Transición Taeguk 8 - L1 a L2 T8",
      "enfoque": "Enfoque en la correcta transición",
      "reps": "30 reps",
      "tipo": "video",
      "url": "https://drive.google.com/file/d/1PC4Rgs-4I6Bml1FTC-kl_bljImEfCow8/view?usp=drive_link"
    }
  ],
  "apuntes": [
    "LEER NOTAS FINALES"
  ],
  "notasFinales": [
    "En esta semana le dimos mucho importancia a la línea 2 de taeguk 8, en estos casos es de vital importancia las trnaiciones y la correcta forma de ejecutar nuestros movimientos de cadera, bola dell pie y fijación de hombros, tomen muy en cuenta lo que vimos en clase (ya esta en las clases grabadas en la carpeta) y en base a eso, mejorar nuestros movimientos",
    "Cualquier duda, por favor comentame",
    "¡Feliz entrenamiento!"
  ]
}
