{
  "updated_at": "Actualizado dom 10 de mayo",
  "nivel": "Nivel Dragones",
  "ciclo": "Lunes 11 al sábado 23 de mayo del 2026",
  "enfoque_corto": "Flexibilidad + Isométrico + Yop Chagui + Movilidad de Cadera",
  "enfoque": "Desarrollo de la potencia estructural en Yop Chagui, priorizando la extensión total de la pierna de base y el control neuromuscular de la cadera.",
  "chanonaflexDias": "LUNES A SÁBADO · 1 serie",
  "chanonaflex": [
    {
      "titulo": "ChanonaFlex • Nivel 1",
      "dia": "LUNES A SÁBADO",
      "tipo": "video",
      "url": "https://drive.google.com/file/d/1jnSjVKx7mPFKco3HttgzmQUQgAsMm9Kt/view?usp=drive_link"
    },
    {
      "titulo": "Pre-Chanonaflex - Estiramiento inicial",
      "dia": "LUNES A SÁBADO",
      "tipo": "video",
      "url": "https://drive.google.com/file/d/1mV7dkockaExAief_qW7RsMUuouwfMKM7/view?usp=drive_link"
    }
  ],
  "isometricoDias": "LUNES - MIÉRCOLES - VIERNES",
  "isometrico": [
    {
      "titulo": "Isométrico Activo - Yop Chagui - Nivel 1",
      "tipo": "video",
      "url": "https://drive.google.com/file/d/1ptuIEmfskjKeBhYfvW4JZVvW5hIIdCbx/view?usp=drive_link",
      "tags": ["FUERZA, FORTALECIMIENTO, FLEX"]
    }
  ],
  "pateoDias": "MARTES - JUEVES - SÁBADO",
  "pateoTecnico": [
    {
      "titulo": "Secuencia Ap + Dollyo + Yop",
      "enfoque": "Control de transiciones y eje corporal",
      "reps": "5 reps por pierna / 2 series",
      "tipo": "video",
      "url": "https://drive.google.com/open?id=1mpJeBddYKmXUuJUMocQN42QzRwtlzSqr"
    },
    {
      "titulo": "Ap + Dollyo + Yop con regreso",
      "enfoque": "Fortalecimiento de pierna de apoyo",
      "reps": "8 reps por lado / 2 series",
      "tipo": "video",
      "url": "https://drive.google.com/open?id=1pUIqQv-TZfUGYydpdg8bMH9qJrEpVTXR"
    },
    {
      "titulo": "Circuito Yop chagui con Bloque",
      "enfoque": "Control de altura y estabilidad",
      "reps": "10 reps / 2 series",
      "tipo": "video",
      "url": "https://drive.google.com/open?id=1KM43-3SXmlc6A-4DTSN3q9aLeZ6A2kgo"
    },
    {
      "titulo": "Torcion cadera con banda",
      "enfoque": "Movilidad de cadera y potencia",
      "reps": "20 reps por lado / 2 series",
      "tipo": "video",
      "url": "https://drive.google.com/open?id=1-mLzWj3XiEzCeul7LaIWuPzP39qQ6VtQ"
    },
    {
      "titulo": "Ejercicio 1 - Yop Chagui",
      "enfoque": "Fortalecimiento para explosividad",
      "reps": "15 reps por pierna / 2 series",
      "tipo": "video",
      "url": "https://drive.google.com/file/d/1IEhzAjlydHdjRSleXxWLABQfMTMsOMG1/view?usp=drive_link"
    }
  ],
  "poomsaeDias": "NO ASIGNADO POR EL MOMENTO",
  "poomsae": [],
  "apuntes": [
    "Busca específicamente no flexionar la pierna de apoyo cuando estamos pateando; esta siempre debe estar firme y extendida en nuestra Yop Chagui para evitar pérdida de puntuación.",
    "En nuestra postura siempre debemos mantener nuestra firmeza en el torso. No debemos llevar los hombros al frente; recuerda que el torso es el reflejo del control técnico.",
    "Debemos direccionar siempre con nuestra rodilla hacia donde estamos pateando. Incluso en Yop Chagui, la correcta flexión al pecho es el inicio de una patada efectiva.",
    "La movilidad de cadera es clave: utiliza los circuitos con banda para ganar rango sin sacrificar la alineación del eje.",
    "No permitas que el talón de apoyo se eleve. Mantenerlo en el piso es lo que nos dará la estabilidad necesaria para que el pateo sea contundente."
  ],
  "notasFinales": [
    "Continuamos construyendo la base profesional de tu pateo. Este ciclo sin poomsae es para apretar las tuercas en lo físico y técnico-estructural.",
    "He agregado los nuevos circuitos de encadenamiento. Pon especial atención a la transición de la rodilla en la secuencia Ap+Dollyo+Yop.",
    "Cualquier duda con los nuevos ejercicios de movilidad de cadera, coméntame de inmediato.",
    "¡Feliz entrenamiento y a darle con todo!"
  ]
}
